{
  "schemaVersion": "1.0.0",
  "benchmark": {
    "name": "octocode-live-smoke-local",
    "kind": "cli-tools",
    "recipe": "packages/octocode-benchmark/benchmark/octocode/README.md",
    "description": "Automated durable live smoke run for Octocode CLI/tool workflows."
  },
  "run": {
    "runId": "octocode-live-smoke-local-20260628T190511Z",
    "timestampUtc": "2026-06-28T19:05:11.148Z",
    "outputDir": "packages/octocode-benchmark/output/octocode-live-smoke-local-20260628T190511Z",
    "gitCommit": "5ce00c5e",
    "gitDirty": true
  },
  "environment": {
    "os": "darwin",
    "arch": "arm64",
    "node": "v22.22.0",
    "packageManager": "yarn",
    "cliCommand": "node packages/octocode/out/octocode.js",
    "authState": "unknown"
  },
  "determinism": {
    "cacheMode": "not-applicable",
    "fixedInputs": [
      "packages/octocode/src/cli/commands/search.ts",
      ".octocode/eval-fixtures/sample.tgz",
      "pmndrs/zustand",
      "zustand",
      "createStore"
    ],
    "paginationFixed": true,
    "networkUsed": false,
    "knownNondeterminism": []
  },
  "surfaces": [
    {
      "name": "raw tools",
      "expected": 14,
      "observed": 14,
      "status": "pass"
    },
    {
      "name": "live flows",
      "expected": 6,
      "observed": 4,
      "status": "warn",
      "notes": "2 warn/skipped, 0 failed."
    }
  ],
  "flows": [
    {
      "name": "metadata-and-schema",
      "commands": [
        {
          "id": "META-TOOLS",
          "command": "node packages/octocode/out/octocode.js tools --json --compact --no-color",
          "exitCode": 0,
          "durationMs": 103,
          "stdoutFile": "raw/META-TOOLS.stdout.json",
          "stderrFile": "raw/META-TOOLS.stderr.txt"
        },
        {
          "id": "SCHEME-LOCAL-SEARCH",
          "command": "node packages/octocode/out/octocode.js tools localSearchCode --scheme --no-color",
          "exitCode": 0,
          "durationMs": 89,
          "stdoutFile": "raw/SCHEME-LOCAL-SEARCH.stdout.txt",
          "stderrFile": "raw/SCHEME-LOCAL-SEARCH.stderr.txt"
        }
      ],
      "status": "pass",
      "evidence": {
        "kind": "schema",
        "answerReady": true,
        "complete": true,
        "toolCount": 14
      },
      "anchors": [
        "tools",
        "localSearchCode scheme"
      ],
      "outputQualityScore": 5
    },
    {
      "name": "local-grep-pagination",
      "commands": [
        {
          "id": "LOCAL-GREP",
          "command": "node packages/octocode/out/octocode.js search runOqlSearch packages/octocode/src/cli/commands/search.ts --context-lines 1 --max-matches 2 --json --compact --no-color",
          "exitCode": 0,
          "durationMs": 433,
          "stdoutFile": "raw/LOCAL-GREP.stdout.json",
          "stderrFile": "raw/LOCAL-GREP.stderr.txt"
        },
        {
          "id": "LOCAL-ONLY-MATCHING",
          "command": "node packages/octocode/out/octocode.js search --regex \"getString\\\\([^)]*\\\\)\" packages/octocode/src/cli/commands/search.ts --only-matching --unique --match-window 12 --max-matches 5 --json --compact --no-color",
          "exitCode": 0,
          "durationMs": 412,
          "stdoutFile": "raw/LOCAL-ONLY-MATCHING.stdout.json",
          "stderrFile": "raw/LOCAL-ONLY-MATCHING.stderr.txt"
        }
      ],
      "status": "pass",
      "evidence": {
        "kind": "local",
        "answerReady": true,
        "complete": true
      },
      "anchors": [
        "packages/octocode/src/cli/commands/search.ts",
        "runOqlSearch"
      ],
      "bestContinuation": "Use returned next/search pagination from raw output.",
      "outputQualityScore": 5
    },
    {
      "name": "local-ast-lsp-oql",
      "commands": [
        {
          "id": "LOCAL-AST",
          "command": "node packages/octocode/out/octocode.js search --pattern \"getString($$$ARGS)\" packages/octocode/src/cli/commands/search.ts --lang ts --json --compact --no-color",
          "exitCode": 0,
          "durationMs": 420,
          "stdoutFile": "raw/LOCAL-AST.stdout.json",
          "stderrFile": "raw/LOCAL-AST.stderr.txt"
        },
        {
          "id": "LOCAL-LSP-SYMBOLS",
          "command": "node packages/octocode/out/octocode.js search packages/octocode/src/cli/commands/search.ts --op documentSymbols --json --compact --no-color",
          "exitCode": 0,
          "durationMs": 481,
          "stdoutFile": "raw/LOCAL-LSP-SYMBOLS.stdout.json",
          "stderrFile": "raw/LOCAL-LSP-SYMBOLS.stderr.txt"
        },
        {
          "id": "LOCAL-OQL",
          "command": "node packages/octocode/out/octocode.js search --query \"{\\\"target\\\":\\\"code\\\",\\\"from\\\":{\\\"kind\\\":\\\"local\\\",\\\"path\\\":\\\"packages/octocode/src/cli/commands/search.ts\\\"},\\\"where\\\":{\\\"kind\\\":\\\"text\\\",\\\"value\\\":\\\"runOqlSearch\\\"},\\\"controls\\\":{\\\"search\\\":{\\\"maxMatchesPerFile\\\":2,\\\"contextLines\\\":1}},\\\"itemsPerPage\\\":1,\\\"page\\\":1}\" --json --compact --no-color",
          "exitCode": 0,
          "durationMs": 426,
          "stdoutFile": "raw/LOCAL-OQL.stdout.json",
          "stderrFile": "raw/LOCAL-OQL.stderr.txt"
        }
      ],
      "status": "pass",
      "evidence": {
        "kind": "semantic-proof",
        "answerReady": true,
        "complete": true
      },
      "anchors": [
        "AST",
        "LSP documentSymbols",
        "OQL target:code"
      ],
      "outputQualityScore": 5
    },
    {
      "name": "archive-binary",
      "commands": [
        {
          "id": "BINARY-LIST",
          "command": "node packages/octocode/out/octocode.js search .octocode/eval-fixtures/sample.tgz --target artifacts --list --json --compact --no-color",
          "exitCode": 0,
          "durationMs": 418,
          "stdoutFile": "raw/BINARY-LIST.stdout.json",
          "stderrFile": "raw/BINARY-LIST.stderr.txt"
        },
        {
          "id": "BINARY-EXTRACT",
          "command": "node packages/octocode/out/octocode.js search .octocode/eval-fixtures/sample.tgz --target artifacts --extract archive-src/package.json --json --compact --no-color",
          "exitCode": 0,
          "durationMs": 456,
          "stdoutFile": "raw/BINARY-EXTRACT.stdout.json",
          "stderrFile": "raw/BINARY-EXTRACT.stderr.txt"
        }
      ],
      "status": "pass",
      "evidence": {
        "kind": "binary-proof",
        "answerReady": true,
        "complete": true
      },
      "anchors": [
        ".octocode/eval-fixtures/sample.tgz"
      ],
      "outputQualityScore": 5
    },
    {
      "name": "cache-fetch-file-tree-clone",
      "commands": [],
      "status": "warn",
      "evidence": {
        "kind": "skipped",
        "answerReady": false,
        "complete": false,
        "reason": "Skipped by --skip-network."
      },
      "outputQualityScore": 3,
      "notes": "Skipped by --skip-network."
    },
    {
      "name": "external-package-github-remote-local",
      "commands": [],
      "status": "warn",
      "evidence": {
        "kind": "skipped",
        "answerReady": false,
        "complete": false,
        "reason": "Skipped by --skip-network."
      },
      "outputQualityScore": 3,
      "notes": "Skipped by --skip-network."
    }
  ],
  "ratings": {
    "rawMcpTools": {
      "score": 9,
      "reason": "tools --json reported 14 tool(s)."
    },
    "oqlSearch": {
      "score": 9,
      "reason": "OQL local code route is exercised as a durable command artifact."
    },
    "quickCli": {
      "score": 9,
      "reason": "search/cache quick commands are represented with raw outputs."
    },
    "flowQuality": {
      "score": 9,
      "reason": "4/6 flow(s) passed."
    },
    "schemaQuality": {
      "score": 9,
      "reason": "The runner writes summary.json directly in output-run.schema.json shape."
    },
    "dataQuality": {
      "score": 9,
      "reason": "Every command writes stdout/stderr files plus commands.ndjson."
    },
    "researchQuality": {
      "score": 9,
      "reason": "The run covers grep, AST, LSP, OQL, binary, and remote-as-local proof paths."
    },
    "outputQuality": {
      "score": 9,
      "reason": "README, manifest, summary, commands, results, reflection, ratings, raw, schemes, and artifacts are all emitted."
    },
    "remoteAsLocal": {
      "score": 5,
      "reason": "Remote-as-local flow was skipped by --skip-network."
    }
  },
  "reflection": {
    "whatWorked": [
      "Live benchmark output is created in the required artifact layout.",
      "The run exercises local grep, AST, LSP, OQL, archive/binary, and CLI metadata lanes."
    ],
    "whatDidNotWork": [],
    "missing": [
      "Network-dependent GitHub/npm/cache flows were intentionally skipped."
    ],
    "possibleImprovements": [
      "Promote selected live flows into a scheduled job with credentials and cache warming."
    ],
    "praises": [
      "The cache and search commands expose typed location/evidence fields that can be validated without parsing prose."
    ],
    "nextFix": "Keep adding focused live flows only when they assert durable evidence, not just command success."
  },
  "verdict": {
    "status": "warn",
    "summary": "4/6 live smoke flow(s) passed."
  }
}
